season,id,name,short_name,description,home_team,away_team,toss_won,decision,1st_inning_score,2nd_inning_score,home_score,away_score,winner,result,start_date,end_date,venue_id,venue_name,home_captain,away_captain,pom,points,super_over,home_overs,home_runs,home_wickets,home_boundaries,away_overs,away_runs,away_wickets,away_boundaries,highlights,home_key_batsman,home_key_bowler,home_playx1,away_playx1,away_key_batsman,away_key_bowler,match_days,umpire1,umpire2,tv_umpire,referee,reserve_umpire
2024,1422138,Mumbai Indians v Delhi Capitals,MI v DC,"20th Match (D/N), Indian Premier League at Mumbai, Apr 7 2024",MI,DC,DC,BOWL FIRST,234/5,205/8,234/5,205/8,MI,MI won by 29 runs,2024-04-07T10:00Z,2024-04-08T23:59Z,58324,"Wankhede Stadium, Mumbai",Hardik Pandya,Rishabh Pant,Romario Shepherd,"Mumbai Indians 2, Delhi Capitals 0",False,20,234,5,33,20,205,8,29,"Shepherd, David and Bumrah help Mumbai get off the mark. Stubbs' blazing fifty not enough as Coetzee picks up four wickets to consign Capitals to a fourth loss in five games","Rohit Sharma,Tim David","Gerald Coetzee,Jasprit Bumrah","Rohit Sharma (UKN),Ishan Kishan (WK),Suryakumar Yadav (UKN),Hardik Pandya (AR),Tilak Varma (AR),Tim David (UKN),Romario Shepherd (AR),Mohammad Nabi (AR),Gerald Coetzee (BL),Piyush Chawla (AR),Jasprit Bumrah (BL),Akash Madhwal (BL)","Prithvi Shaw (UKN),David Warner (UKN),Abishek Porel (UKN),Tristan Stubbs (UKN),Rishabh Pant (WK),Axar Patel (AR),Lalit Yadav (AR),Kumar Kushagra (UKN),Jhye Richardson (BL),Anrich Nortje (BL),Ishant Sharma (BL),Khaleel Ahmed (BL)","Tristan Stubbs,Prithvi Shaw","Axar Patel,Anrich Nortje",7 April 2024 - day/night match (20-over match),Kumar Dharmasena,Ulhas Gandhe,KN Ananthapadmanabhan,Prakash Bhatt,Vaibhav Dhokre
2024,1422139,Lucknow Super Giants v Gujarat Titans,LSG v GT,"21st Match (N), Indian Premier League at Lucknow, Apr 7 2024",LSG,GT,LSG,BAT FIRST,163/5,130,163/5,130,LSG,LSG won by 33 runs,2024-04-07T14:00Z,2024-04-08T23:59Z,1070094,"Bharat Ratna Shri Atal Bihari Vajpayee Ekana Cricket Stadium, Lucknow",KL Rahul,Shubman Gill,Yash Thakur,"Lucknow Super Giants 2, Gujarat Titans 0",False,20,163,5,17,18.5,130,10,13,"Spinners, Yash Thakur defend 163 to seal LSG's first-ever win against Titans. Titans looked on track in the chase at a point but then lost eight wickets for just 48 runs","Marcus Stoinis,KL Rahul","Yash Thakur,Krunal Pandya","Quinton de Kock (UKN),KL Rahul (WK),Devdutt Padikkal (UKN),Marcus Stoinis (AR),Nicholas Pooran (UKN),Ayush Badoni (UKN),Krunal Pandya (AR),Ravi Bishnoi (BL),Naveen-ul-Haq (BL),Yash Thakur (BL),Mayank Yadav (BL),Manimaran Siddharth (BL)","Sai Sudharsan (UKN),Shubman Gill (UKN),Kane Williamson (UKN),BR Sharath (WK),Vijay Shankar (AR),Darshan Nalkande (BL),Rahul Tewatia (AR),Rashid Khan (AR),Umesh Yadav (BL),Spencer Johnson (BL),Noor Ahmad (BL),Mohit Sharma (BL)","Sai Sudharsan,Rahul Tewatia","Umesh Yadav,Darshan Nalkande",7 April 2024 - night match (20-over match),Nand Kishore,Virender Sharma,Nitin Menon,Javagal Srinath,Madanagopal Kuppuraj
2024,1426260,Chennai Super Kings v Kolkata Knight Riders,CSK v KKR,"22nd Match (N), Indian Premier League at Chennai, Apr 8 2024",CSK,KKR,CSK,BOWL FIRST,137/9,141/3,141/3,137/9,CSK,CSK won by 7 wkts (14b rem),2024-04-08T14:00Z,2024-04-09T23:59Z,58008,"MA Chidambaram Stadium, Chepauk, Chennai",Ruturaj Gaikwad,Shreyas Iyer,Ravindra Jadeja,"Chennai Super Kings 2, Kolkata Knight Riders 0",False,17.4,141,3,18,20,137,9,15,"Jadeja & Co pin KKR before Gaikwad finishes the job. On a track typical of the ones we've seen at Chepauk in seasons past, Super Kings handed Knight Riders their first loss of IPL 2024","Ruturaj Gaikwad,Shivam Dube","Ravindra Jadeja,Tushar Deshpande","Rachin Ravindra (AR),Ruturaj Gaikwad (UKN),Daryl Mitchell (AR),Shivam Dube (AR),MS Dhoni (WK),Ajinkya Rahane (UKN),Sameer Rizvi (UKN),Ravindra Jadeja (AR),Shardul Thakur (BL),Tushar Deshpande (BL),Maheesh Theekshana (BL),Mustafizur Rahman (BL)","Phil Salt (WK),Sunil Narine (AR),Angkrish Raghuvanshi (UKN),Shreyas Iyer (UKN),Venkatesh Iyer (AR),Ramandeep Singh (UKN),Rinku Singh (UKN),Andre Russell (AR),Anukul Roy (AR),Mitchell Starc (BL),Vaibhav Arora (BL),Varun Chakravarthy (BL)","Shreyas Iyer,Sunil Narine","Vaibhav Arora,Sunil Narine",8 April 2024 - night match (20-over match),Anil Chaudhary,Saidharshan Kumar,Bruce Oxenford,Manu Nayar,Mohit Krishnadas
2024,1426261,Punjab Kings v Sunrisers Hyderabad,PBKS v SRH,"23rd Match (N), Indian Premier League at Mohali, Apr 9 2024",PBKS,SRH,KXIP,BOWL FIRST,,,182/9,"180/6 (20 ov, target 183)",SRH,SRH won by 2 runs,2024-04-09T14:00Z,2024-04-10T23:59Z,1290799,"Maharaja Yadavindra Singh International Cricket Stadium, Mullanpur",Shikhar Dhawan,Pat Cummins,Nitish Kumar Reddy,"Sunrisers Hyderabad 2, Punjab Kings 0",False,,,,,,,,,,,,,,,,,,,,,
,1426262,Rajasthan Royals v Gujarat Titans,RR v GT,"24th Match (N), Indian Premier League at Jaipur, Apr 10 2024",RR,GT,,,,,,,GT,Starts at 19:30 local time,2024-04-10T14:00Z,2024-04-11T23:59Z,58162,"Sawai Mansingh Stadium, Jaipur",,,,,,,,,,,,,,,,,,,,,,,,,,
,1426263,Mumbai Indians v Royal Challengers Bengaluru,MI v RCB,"25th Match (N), Indian Premier League at Mumbai, Apr 11 2024",MI,RCB,,,,,,,RCB,Starts at 19:30 local time,2024-04-11T14:00Z,2024-04-12T23:59Z,58324,"Wankhede Stadium, Mumbai",,,,,,,,,,,,,,,,,,,,,,,,,,
,1426264,Lucknow Super Giants v Delhi Capitals,LSG v DC,"26th Match (N), Indian Premier League at Lucknow, Apr 12 2024",LSG,DC,,,,,,,DC,Starts at 19:30 local time,2024-04-12T14:00Z,2024-04-13T23:59Z,1070094,"Bharat Ratna Shri Atal Bihari Vajpayee Ekana Cricket Stadium, Lucknow",,,,,,,,,,,,,,,,,,,,,,,,,,
,1426265,Punjab Kings v Rajasthan Royals,PBKS v RR,"27th Match (N), Indian Premier League at Mohali, Apr 13 2024",PBKS,RR,,,,,,,RR,Starts at 19:30 local time,2024-04-13T14:00Z,2024-04-14T23:59Z,1290799,"Maharaja Yadavindra Singh International Cricket Stadium, Mullanpur",,,,,,,,,,,,,,,,,,,,,,,,,,
,1426266,Kolkata Knight Riders v Lucknow Super Giants,KKR v LSG,"28th Match (D/N), Indian Premier League at Kolkata, Apr 14 2024",KKR,LSG,,,,,,,LSG,Starts at 15:30 local time,2024-04-14T10:00Z,2024-04-15T23:59Z,57980,"Eden Gardens, Kolkata",,,,,,,,,,,,,,,,,,,,,,,,,,
,1426267,Mumbai Indians v Chennai Super Kings,MI v CSK,"29th Match (N), Indian Premier League at Mumbai, Apr 14 2024",MI,CSK,,,,,,,CSK,Starts at 19:30 local time,2024-04-14T14:00Z,2024-04-15T23:59Z,58324,"Wankhede Stadium, Mumbai",,,,,,,,,,,,,,,,,,,,,,,,,,
,1426268,Royal Challengers Bengaluru v Sunrisers Hyderabad,RCB v SRH,"30th Match (N), Indian Premier League at Bengaluru, Apr 15 2024",RCB,SRH,,,,,,,SRH,Starts at 19:30 local time,2024-04-15T14:00Z,2024-04-16T23:59Z,57897,"M.Chinnaswamy Stadium, Bengaluru",,,,,,,,,,,,,,,,,,,,,,,,,,
,1426269,Kolkata Knight Riders v Rajasthan Royals,KKR v RR,"31st Match (N), Indian Premier League at Kolkata, Apr 16 2024",KKR,RR,,,,,,,RR,Starts at 19:30 local time,2024-04-16T14:00Z,2024-04-17T23:59Z,57980,"Eden Gardens, Kolkata",,,,,,,,,,,,,,,,,,,,,,,,,,
,1426270,Gujarat Titans v Delhi Capitals,GT v DC,"32nd Match (N), Indian Premier League at Ahmedabad, Apr 17 2024",GT,DC,,,,,,,DC,Starts at 19:30 local time,2024-04-17T14:00Z,2024-04-18T23:59Z,57851,"Narendra Modi Stadium, Motera, Ahmedabad",,,,,,,,,,,,,,,,,,,,,,,,,,
,1426271,Punjab Kings v Mumbai Indians,PBKS v MI,"33rd Match (N), Indian Premier League at Mohali, Apr 18 2024",PBKS,MI,,,,,,,MI,Starts at 19:30 local time,2024-04-18T14:00Z,2024-04-19T23:59Z,1290799,"Maharaja Yadavindra Singh International Cricket Stadium, Mullanpur",,,,,,,,,,,,,,,,,,,,,,,,,,
,1426272,Lucknow Super Giants v Chennai Super Kings,LSG v CSK,"34th Match (N), Indian Premier League at Lucknow, Apr 19 2024",LSG,CSK,,,,,,,CSK,Starts at 19:30 local time,2024-04-19T14:00Z,2024-04-20T23:59Z,1070094,"Bharat Ratna Shri Atal Bihari Vajpayee Ekana Cricket Stadium, Lucknow",,,,,,,,,,,,,,,,,,,,,,,,,,
,1426273,Delhi Capitals v Sunrisers Hyderabad,DC v SRH,"35th Match (N), Indian Premier League at Delhi, Apr 20 2024",DC,SRH,,,,,,,SRH,Starts at 19:30 local time,2024-04-20T14:00Z,2024-04-21T23:59Z,58040,"Arun Jaitley Stadium, Delhi",,,,,,,,,,,,,,,,,,,,,,,,,,
,1426274,Kolkata Knight Riders v Royal Challengers Bengaluru,KKR v RCB,"36th Match (D/N), Indian Premier League at Kolkata, Apr 21 2024",KKR,RCB,,,,,,,RCB,Starts at 15:30 local time,2024-04-21T10:00Z,2024-04-22T23:59Z,57980,"Eden Gardens, Kolkata",,,,,,,,,,,,,,,,,,,,,,,,,,
,1426275,Punjab Kings v Gujarat Titans,PBKS v GT,"37th Match (N), Indian Premier League at Mohali, Apr 21 2024",PBKS,GT,,,,,,,GT,Starts at 19:30 local time,2024-04-21T14:00Z,2024-04-22T23:59Z,1290799,"Maharaja Yadavindra Singh International Cricket Stadium, Mullanpur",,,,,,,,,,,,,,,,,,,,,,,,,,
,1426276,Rajasthan Royals v Mumbai Indians,RR v MI,"38th Match (N), Indian Premier League at Jaipur, Apr 22 2024",RR,MI,,,,,,,MI,Starts at 19:30 local time,2024-04-22T14:00Z,2024-04-23T23:59Z,58162,"Sawai Mansingh Stadium, Jaipur",,,,,,,,,,,,,,,,,,,,,,,,,,
,1426277,Chennai Super Kings v Lucknow Super Giants,CSK v LSG,"39th Match (N), Indian Premier League at Chennai, Apr 23 2024",CSK,LSG,,,,,,,LSG,Starts at 19:30 local time,2024-04-23T14:00Z,2024-04-24T23:59Z,58008,"MA Chidambaram Stadium, Chepauk, Chennai",,,,,,,,,,,,,,,,,,,,,,,,,,
,1426278,Delhi Capitals v Gujarat Titans,DC v GT,"40th Match (N), Indian Premier League at Delhi, Apr 24 2024",DC,GT,,,,,,,GT,Starts at 19:30 local time,2024-04-24T14:00Z,2024-04-25T23:59Z,58040,"Arun Jaitley Stadium, Delhi",,,,,,,,,,,,,,,,,,,,,,,,,,
,1426279,Sunrisers Hyderabad v Royal Challengers Bengaluru,SRH v RCB,"41st Match (N), Indian Premier League at Hyderabad, Apr 25 2024",SRH,RCB,,,,,,,RCB,Starts at 19:30 local time,2024-04-25T14:00Z,2024-04-26T23:59Z,58142,"Rajiv Gandhi International Stadium, Uppal, Hyderabad",,,,,,,,,,,,,,,,,,,,,,,,,,
,1426280,Kolkata Knight Riders v Punjab Kings,KKR v PBKS,"42nd Match (N), Indian Premier League at Kolkata, Apr 26 2024",KKR,PBKS,,,,,,,PBKS,Starts at 19:30 local time,2024-04-26T14:00Z,2024-04-27T23:59Z,57980,"Eden Gardens, Kolkata",,,,,,,,,,,,,,,,,,,,,,,,,,
,1426281,Delhi Capitals v Mumbai Indians,DC v MI,"43rd Match (D/N), Indian Premier League at Delhi, Apr 27 2024",DC,MI,,,,,,,MI,Starts at 15:30 local time,2024-04-27T10:00Z,2024-04-28T23:59Z,58040,"Arun Jaitley Stadium, Delhi",,,,,,,,,,,,,,,,,,,,,,,,,,
,1426282,Lucknow Super Giants v Rajasthan Royals,LSG v RR,"44th Match (N), Indian Premier League at Lucknow, Apr 27 2024",LSG,RR,,,,,,,RR,Starts at 19:30 local time,2024-04-27T14:00Z,2024-04-28T23:59Z,1070094,"Bharat Ratna Shri Atal Bihari Vajpayee Ekana Cricket Stadium, Lucknow",,,,,,,,,,,,,,,,,,,,,,,,,,
,1426283,Gujarat Titans v Royal Challengers Bengaluru,GT v RCB,"45th Match (D/N), Indian Premier League at Ahmedabad, Apr 28 2024",GT,RCB,,,,,,,RCB,Starts at 15:30 local time,2024-04-28T10:00Z,2024-04-29T23:59Z,57851,"Narendra Modi Stadium, Motera, Ahmedabad",,,,,,,,,,,,,,,,,,,,,,,,,,
,1426284,Chennai Super Kings v Sunrisers Hyderabad,CSK v SRH,"46th Match (N), Indian Premier League at Chennai, Apr 28 2024",CSK,SRH,,,,,,,SRH,Starts at 19:30 local time,2024-04-28T14:00Z,2024-04-29T23:59Z,58008,"MA Chidambaram Stadium, Chepauk, Chennai",,,,,,,,,,,,,,,,,,,,,,,,,,
,1426285,Kolkata Knight Riders v Delhi Capitals,KKR v DC,"47th Match (N), Indian Premier League at Kolkata, Apr 29 2024",KKR,DC,,,,,,,DC,Starts at 19:30 local time,2024-04-29T14:00Z,2024-04-30T23:59Z,57980,"Eden Gardens, Kolkata",,,,,,,,,,,,,,,,,,,,,,,,,,
,1426286,Lucknow Super Giants v Mumbai Indians,LSG v MI,"48th Match (N), Indian Premier League at Lucknow, Apr 30 2024",LSG,MI,,,,,,,MI,Starts at 19:30 local time,2024-04-30T14:00Z,2024-05-01T23:59Z,1070094,"Bharat Ratna Shri Atal Bihari Vajpayee Ekana Cricket Stadium, Lucknow",,,,,,,,,,,,,,,,,,,,,,,,,,
,1426287,Chennai Super Kings v Punjab Kings,CSK v PBKS,"49th Match (N), Indian Premier League at Chennai, May 1 2024",CSK,PBKS,,,,,,,PBKS,Starts at 19:30 local time,2024-05-01T14:00Z,2024-05-02T23:59Z,58008,"MA Chidambaram Stadium, Chepauk, Chennai",,,,,,,,,,,,,,,,,,,,,,,,,,
,1426288,Sunrisers Hyderabad v Rajasthan Royals,SRH v RR,"50th Match (N), Indian Premier League at Hyderabad, May 2 2024",SRH,RR,,,,,,,RR,Starts at 19:30 local time,2024-05-02T14:00Z,2024-05-03T23:59Z,58142,"Rajiv Gandhi International Stadium, Uppal, Hyderabad",,,,,,,,,,,,,,,,,,,,,,,,,,
,1426289,Mumbai Indians v Kolkata Knight Riders,MI v KKR,"51st Match (N), Indian Premier League at Mumbai, May 3 2024",MI,KKR,,,,,,,KKR,Starts at 19:30 local time,2024-05-03T14:00Z,2024-05-04T23:59Z,58324,"Wankhede Stadium, Mumbai",,,,,,,,,,,,,,,,,,,,,,,,,,
,1426290,Royal Challengers Bengaluru v Gujarat Titans,RCB v GT,"52nd Match (N), Indian Premier League at Bengaluru, May 4 2024",RCB,GT,,,,,,,GT,Starts at 19:30 local time,2024-05-04T14:00Z,2024-05-05T23:59Z,57897,"M.Chinnaswamy Stadium, Bengaluru",,,,,,,,,,,,,,,,,,,,,,,,,,
,1426291,Punjab Kings v Chennai Super Kings,PBKS v CSK,"53rd Match (D/N), Indian Premier League at Dharamsala, May 5 2024",PBKS,CSK,,,,,,,CSK,Starts at 15:30 local time,2024-05-05T10:00Z,2024-05-06T23:59Z,58056,"Himachal Pradesh Cricket Association Stadium, Dharamsala",,,,,,,,,,,,,,,,,,,,,,,,,,
,1426292,Lucknow Super Giants v Kolkata Knight Riders,LSG v KKR,"54th Match (N), Indian Premier League at Lucknow, May 5 2024",LSG,KKR,,,,,,,KKR,Starts at 19:30 local time,2024-05-05T14:00Z,2024-05-06T23:59Z,1070094,"Bharat Ratna Shri Atal Bihari Vajpayee Ekana Cricket Stadium, Lucknow",,,,,,,,,,,,,,,,,,,,,,,,,,
,1426293,Mumbai Indians v Sunrisers Hyderabad,MI v SRH,"55th Match (N), Indian Premier League at Mumbai, May 6 2024",MI,SRH,,,,,,,SRH,Starts at 19:30 local time,2024-05-06T14:00Z,2024-05-07T23:59Z,58324,"Wankhede Stadium, Mumbai",,,,,,,,,,,,,,,,,,,,,,,,,,
,1426294,Delhi Capitals v Rajasthan Royals,DC v RR,"56th Match (N), Indian Premier League at Delhi, May 7 2024",DC,RR,,,,,,,RR,Starts at 19:30 local time,2024-05-07T14:00Z,2024-05-08T23:59Z,58040,"Arun Jaitley Stadium, Delhi",,,,,,,,,,,,,,,,,,,,,,,,,,
,1426295,Sunrisers Hyderabad v Lucknow Super Giants,SRH v LSG,"57th Match (N), Indian Premier League at Hyderabad, May 8 2024",SRH,LSG,,,,,,,LSG,Starts at 19:30 local time,2024-05-08T14:00Z,2024-05-09T23:59Z,58142,"Rajiv Gandhi International Stadium, Uppal, Hyderabad",,,,,,,,,,,,,,,,,,,,,,,,,,
,1426296,Punjab Kings v Royal Challengers Bengaluru,PBKS v RCB,"58th Match (N), Indian Premier League at Dharamsala, May 9 2024",PBKS,RCB,,,,,,,RCB,Starts at 19:30 local time,2024-05-09T14:00Z,2024-05-10T23:59Z,58056,"Himachal Pradesh Cricket Association Stadium, Dharamsala",,,,,,,,,,,,,,,,,,,,,,,,,,
,1426297,Gujarat Titans v Chennai Super Kings,GT v CSK,"59th Match (N), Indian Premier League at Ahmedabad, May 10 2024",GT,CSK,,,,,,,CSK,Starts at 19:30 local time,2024-05-10T14:00Z,2024-05-11T23:59Z,57851,"Narendra Modi Stadium, Motera, Ahmedabad",,,,,,,,,,,,,,,,,,,,,,,,,,
,1426298,Kolkata Knight Riders v Mumbai Indians,KKR v MI,"60th Match (N), Indian Premier League at Kolkata, May 11 2024",KKR,MI,,,,,,,MI,Starts at 19:30 local time,2024-05-11T14:00Z,2024-05-12T23:59Z,57980,"Eden Gardens, Kolkata",,,,,,,,,,,,,,,,,,,,,,,,,,
,1426299,Chennai Super Kings v Rajasthan Royals,CSK v RR,"61st Match (D/N), Indian Premier League at Chennai, May 12 2024",CSK,RR,,,,,,,RR,Starts at 15:30 local time,2024-05-12T10:00Z,2024-05-13T23:59Z,58008,"MA Chidambaram Stadium, Chepauk, Chennai",,,,,,,,,,,,,,,,,,,,,,,,,,
,1426300,Royal Challengers Bengaluru v Delhi Capitals,RCB v DC,"62nd Match (N), Indian Premier League at Bengaluru, May 12 2024",RCB,DC,,,,,,,DC,Starts at 19:30 local time,2024-05-12T14:00Z,2024-05-13T23:59Z,57897,"M.Chinnaswamy Stadium, Bengaluru",,,,,,,,,,,,,,,,,,,,,,,,,,
,1426301,Gujarat Titans v Kolkata Knight Riders,GT v KKR,"63rd Match (N), Indian Premier League at Ahmedabad, May 13 2024",GT,KKR,,,,,,,KKR,Starts at 19:30 local time,2024-05-13T14:00Z,2024-05-14T23:59Z,57851,"Narendra Modi Stadium, Motera, Ahmedabad",,,,,,,,,,,,,,,,,,,,,,,,,,
,1426302,Delhi Capitals v Lucknow Super Giants,DC v LSG,"64th Match (N), Indian Premier League at Delhi, May 14 2024",DC,LSG,,,,,,,LSG,Starts at 19:30 local time,2024-05-14T14:00Z,2024-05-15T23:59Z,58040,"Arun Jaitley Stadium, Delhi",,,,,,,,,,,,,,,,,,,,,,,,,,
,1426303,Rajasthan Royals v Punjab Kings,RR v PBKS,"65th Match (N), Indian Premier League at Guwahati, May 15 2024",RR,PBKS,,,,,,,PBKS,Starts at 19:30 local time,2024-05-15T14:00Z,2024-05-16T23:59Z,680295,"Barsapara Cricket Stadium, Guwahati",,,,,,,,,,,,,,,,,,,,,,,,,,
,1426304,Sunrisers Hyderabad v Gujarat Titans,SRH v GT,"66th Match (N), Indian Premier League at Hyderabad, May 16 2024",SRH,GT,,,,,,,GT,Starts at 19:30 local time,2024-05-16T14:00Z,2024-05-17T23:59Z,58142,"Rajiv Gandhi International Stadium, Uppal, Hyderabad",,,,,,,,,,,,,,,,,,,,,,,,,,
,1426305,Mumbai Indians v Lucknow Super Giants,MI v LSG,"67th Match (N), Indian Premier League at Mumbai, May 17 2024",MI,LSG,,,,,,,LSG,Starts at 19:30 local time,2024-05-17T14:00Z,2024-05-18T23:59Z,58324,"Wankhede Stadium, Mumbai",,,,,,,,,,,,,,,,,,,,,,,,,,
,1426306,Royal Challengers Bengaluru v Chennai Super Kings,RCB v CSK,"68th Match (N), Indian Premier League at Bengaluru, May 18 2024",RCB,CSK,,,,,,,CSK,Starts at 19:30 local time,2024-05-18T14:00Z,2024-05-19T23:59Z,57897,"M.Chinnaswamy Stadium, Bengaluru",,,,,,,,,,,,,,,,,,,,,,,,,,
,1426307,Sunrisers Hyderabad v Punjab Kings,SRH v PBKS,"69th Match (D/N), Indian Premier League at Hyderabad, May 19 2024",SRH,PBKS,,,,,,,PBKS,Starts at 15:30 local time,2024-05-19T10:00Z,2024-05-20T23:59Z,58142,"Rajiv Gandhi International Stadium, Uppal, Hyderabad",,,,,,,,,,,,,,,,,,,,,,,,,,
,1426308,Rajasthan Royals v Kolkata Knight Riders,RR v KKR,"70th Match (N), Indian Premier League at Guwahati, May 19 2024",RR,KKR,,,,,,,KKR,Starts at 19:30 local time,2024-05-19T14:00Z,2024-05-20T23:59Z,680295,"Barsapara Cricket Stadium, Guwahati",,,,,,,,,,,,,,,,,,,,,,,,,,
,1426309,TBC v TBC,TBC v TBC,"Qualifier 1 (N), Indian Premier League at Ahmedabad, May 21 2024",TBA,TBA,,,,,,,TBA,Starts at 19:30 local time,2024-05-21T14:00Z,2024-05-22T23:59Z,57851,"Narendra Modi Stadium, Motera, Ahmedabad",,,,,,,,,,,,,,,,,,,,,,,,,,
,1426310,TBC v TBC,TBC v TBC,"Eliminator (N), Indian Premier League at Ahmedabad, May 22 2024",TBA,TBA,,,,,,,TBA,Starts at 19:30 local time,2024-05-22T14:00Z,2024-05-23T23:59Z,57851,"Narendra Modi Stadium, Motera, Ahmedabad",,,,,,,,,,,,,,,,,,,,,,,,,,
,1426311,TBC v TBC,TBC v TBC,"Qualifier 2 (N), Indian Premier League at Chennai, May 24 2024",TBA,TBA,,,,,,,TBA,Starts at 19:30 local time,2024-05-24T14:00Z,2024-05-25T23:59Z,58008,"MA Chidambaram Stadium, Chepauk, Chennai",,,,,,,,,,,,,,,,,,,,,,,,,,
,1426312,TBC v TBC,TBC v TBC,"Final (N), Indian Premier League at Chennai, May 26 2024",TBA,TBA,,,,,,,TBA,Starts at 19:30 local time,2024-05-26T14:00Z,2024-05-27T23:59Z,58008,"MA Chidambaram Stadium, Chepauk, Chennai",,,,,,,,,,,,,,,,,,,,,,,,,,
